{
  "userId":"085603622877",
  "password":"nyezgdfrlsmc",
  "userFullName": "Ida Newton",
  "emailAddress": "ida.newton@example.com",
  "organisationDetails": {
    "name":"Company ABF123",
    "address": {
      "line1":"1 Abbey Road",
      "line2":"Aberdeen",
      "postcode": "TS1 1PA"
    }
  },
  "individualDetails": {
    "firstName": "Ida",
    "lastName": "Newton",
    "dateOfBirth": "1960-06-01",
    "address": {
      "line1": "45 Springfield Rise",
      "line2": "Glasgow",
      "postcode": "TS1 1PA"
    }
  },
  "saUtr":"8000083480",
  "nino":"XM110477D",
  "empRef":"538/EMKXYNSVTH",
  "ctUtr":"4000082459",
  "vrn":"666119668",
  "vatRegistrationDate":"2001-11-02",
  "mtdItId":"XJIT00000328268",
  "lisaManagerReferenceNumber":"Z123456",
  "secureElectronicTransferReferenceNumber":"123456789012",
  "pensionSchemeAdministratorIdentifier":"A1234567",
  "eoriNumber":"GB123456789012",
  "exciseNumber":"GBWK254706100",
  "crn": "12345678",
  "taxPayerType":"Individual",
  "pillar2Id":"XA1234567890123",
  "zReference": "Z1234",
  "capitalGainsTaxOnUKPropertyReference": "XACGTP123456789",
  "plasticPackagingTaxRegistrationNumber": "XAPPT0001234567",
  "countryByCountryReportingId": "XACBC1234567890",
  "trustsUniqueTaxpayerReference": "8876543210",
  "trustsUniqueReferenceNumber": "XATRUST12345678"
}
